{
  "schema_version": "1.0",
  "dataset_id": "libuv-baseline-v1",
  "review": {
    "human_review": "pending",
    "method": "source_review_by_ai",
    "limitation": "Legacy libuv call labels were selected against the same graph; regression scores are not independent accuracy estimates."
  },
  "repository": "libuv/libuv",
  "commit": "8fb9cb919489a48880680a56efecff6a7dfb4504",
  "cases": [
    {
      "id": "cc_pos_libuv_001",
      "category": "call_chain",
      "identity": [
        "fn:uv_run",
        "fn:uv__io_poll"
      ],
      "kind": "direct_call",
      "expected_exists": true,
      "evidence": [
        {
          "file": "third_party/libuv/src/unix/core.c",
          "line": 460,
          "snippet": "uv__io_poll(loop, timeout);"
        }
      ],
      "notes": "uv_run 的事件轮询入口"
    },
    {
      "id": "cc_pos_libuv_002",
      "category": "call_chain",
      "identity": [
        "fn:uv_run",
        "fn:uv__run_timers"
      ],
      "kind": "direct_call",
      "expected_exists": true,
      "evidence": [
        {
          "file": "third_party/libuv/src/unix/core.c",
          "line": 442,
          "snippet": "uv__run_timers(loop);"
        }
      ],
      "notes": "uv_run 的定时器阶段"
    },
    {
      "id": "cc_pos_libuv_003",
      "category": "call_chain",
      "identity": [
        "fn:uv__run_timers",
        "fn:uv_timer_again"
      ],
      "kind": "direct_call",
      "expected_exists": true,
      "evidence": [
        {
          "file": "third_party/libuv/src/timer.c",
          "line": 192,
          "snippet": "uv_timer_again(handle);"
        }
      ],
      "notes": "重复定时器的重新挂载"
    },
    {
      "id": "cc_pos_libuv_004",
      "category": "call_chain",
      "identity": [
        "fn:uv__io_poll",
        "cb:uv__io_s::cb"
      ],
      "kind": "callback_edge",
      "expected_exists": true,
      "evidence": [
        {
          "file": "third_party/libuv/src/unix/kqueue.c",
          "line": 379,
          "snippet": "w->cb(loop, w, ev->fflags); /* XXX always uv__fs_event() */"
        }
      ],
      "notes": "回调字段 w->cb 的目标集合需要结合赋值流继续收敛"
    },
    {
      "id": "cc_neg_libuv_001",
      "category": "call_chain",
      "identity": [
        "fn:uv_run",
        "fn:uv__queue_remove"
      ],
      "kind": "direct_call",
      "expected_exists": false,
      "evidence": [
        {
          "file": "third_party/libuv/src/timer.c",
          "line": 188,
          "snippet": "uv__queue_remove(queue_node);"
        }
      ],
      "notes": "uv_run 只能经 uv__run_timers 间接到达 uv__queue_remove"
    },
    {
      "id": "cc_neg_libuv_002",
      "category": "call_chain",
      "identity": [
        "fn:uv__run_timers",
        "fn:uv__io_poll"
      ],
      "kind": "direct_call",
      "expected_exists": false,
      "evidence": [
        {
          "file": "third_party/libuv/src/timer.c",
          "line": 192,
          "snippet": "uv_timer_again(handle);"
        }
      ],
      "notes": "uv__run_timers 不直接调用 uv__io_poll"
    },
    {
      "id": "cc_neg_libuv_003",
      "category": "call_chain",
      "identity": [
        "fn:uv_run",
        "fn:uv__io_poll"
      ],
      "kind": "callback_edge",
      "expected_exists": false,
      "evidence": [
        {
          "file": "third_party/libuv/src/unix/core.c",
          "line": 460,
          "snippet": "uv__io_poll(loop, timeout);"
        }
      ],
      "notes": "source/target 存在，但正确 kind 是 direct_call，不是 callback_edge"
    },
    {
      "id": "cc_pos_libuv_005",
      "category": "call_chain",
      "identity": [
        "fn:uv_run",
        "fn:uv__loop_alive"
      ],
      "kind": "direct_call",
      "expected_exists": true,
      "evidence": [
        {
          "file": "third_party/libuv/src/unix/core.c",
          "line": 432,
          "snippet": "r = uv__loop_alive(loop);"
        }
      ],
      "notes": "uv_run 在循环开始前检查 loop 是否还活着"
    },
    {
      "id": "cc_pos_libuv_006",
      "category": "call_chain",
      "identity": [
        "fn:uv_run",
        "fn:uv__update_time"
      ],
      "kind": "direct_call",
      "expected_exists": true,
      "evidence": [
        {
          "file": "third_party/libuv/src/unix/core.c",
          "line": 434,
          "snippet": "uv__update_time(loop);"
        }
      ],
      "notes": "uv_run 在循环开头更新时间"
    },
    {
      "id": "cc_pos_libuv_007",
      "category": "call_chain",
      "identity": [
        "fn:uv_run",
        "fn:uv__run_pending"
      ],
      "kind": "direct_call",
      "expected_exists": true,
      "evidence": [
        {
          "file": "third_party/libuv/src/unix/core.c",
          "line": 450,
          "snippet": "uv__run_pending(loop);"
        }
      ],
      "notes": "uv_run 执行 pending 阶段"
    },
    {
      "id": "cc_pos_libuv_008",
      "category": "call_chain",
      "identity": [
        "fn:uv_run",
        "fn:uv__run_idle"
      ],
      "kind": "direct_call",
      "expected_exists": true,
      "evidence": [
        {
          "file": "third_party/libuv/src/unix/core.c",
          "line": 451,
          "snippet": "uv__run_idle(loop);"
        }
      ],
      "notes": "uv_run 执行 idle 阶段"
    },
    {
      "id": "cc_pos_libuv_009",
      "category": "call_chain",
      "identity": [
        "fn:uv_run",
        "fn:uv__run_prepare"
      ],
      "kind": "direct_call",
      "expected_exists": true,
      "evidence": [
        {
          "file": "third_party/libuv/src/unix/core.c",
          "line": 452,
          "snippet": "uv__run_prepare(loop);"
        }
      ],
      "notes": "uv_run 执行 prepare 阶段"
    },
    {
      "id": "cc_pos_libuv_010",
      "category": "call_chain",
      "identity": [
        "fn:uv_run",
        "fn:uv__backend_timeout"
      ],
      "kind": "direct_call",
      "expected_exists": true,
      "evidence": [
        {
          "file": "third_party/libuv/src/unix/core.c",
          "line": 456,
          "snippet": "timeout = uv__backend_timeout(loop);"
        }
      ],
      "notes": "uv_run 计算 backend timeout"
    },
    {
      "id": "cc_pos_libuv_011",
      "category": "call_chain",
      "identity": [
        "fn:uv_run",
        "fn:uv__run_check"
      ],
      "kind": "direct_call",
      "expected_exists": true,
      "evidence": [
        {
          "file": "third_party/libuv/src/unix/core.c",
          "line": 474,
          "snippet": "uv__run_check(loop);"
        }
      ],
      "notes": "uv_run 执行 check 阶段"
    },
    {
      "id": "cc_pos_libuv_012",
      "category": "call_chain",
      "identity": [
        "fn:uv_run",
        "fn:uv__run_closing_handles"
      ],
      "kind": "direct_call",
      "expected_exists": true,
      "evidence": [
        {
          "file": "third_party/libuv/src/unix/core.c",
          "line": 475,
          "snippet": "uv__run_closing_handles(loop);"
        }
      ],
      "notes": "uv_run 执行 closing handles 阶段"
    },
    {
      "id": "cc_pos_libuv_013",
      "category": "call_chain",
      "identity": [
        "fn:uv_run",
        "fn:uv__queue_empty"
      ],
      "kind": "direct_call",
      "expected_exists": true,
      "evidence": [
        {
          "file": "third_party/libuv/src/unix/core.c",
          "line": 447,
          "snippet": "uv__queue_empty(&loop->pending_queue) &&"
        }
      ],
      "notes": "uv_run 判断 pending queue 是否为空"
    },
    {
      "id": "cc_pos_libuv_014",
      "category": "call_chain",
      "identity": [
        "fn:uv__io_poll",
        "fn:uv__update_time"
      ],
      "kind": "direct_call",
      "expected_exists": true,
      "evidence": [
        {
          "file": "third_party/libuv/src/unix/kqueue.c",
          "line": 306,
          "snippet": "uv__update_time(loop);"
        }
      ],
      "notes": "uv__io_poll 在进入 poll 前更新时间"
    },
    {
      "id": "cc_pos_libuv_015",
      "category": "call_chain",
      "identity": [
        "fn:uv__io_poll",
        "fn:uv__queue_remove"
      ],
      "kind": "direct_call",
      "expected_exists": true,
      "evidence": [
        {
          "file": "third_party/libuv/src/unix/kqueue.c",
          "line": 194,
          "snippet": "uv__queue_remove(q);"
        }
      ],
      "notes": "uv__io_poll 从 watcher queue 移除已注册项"
    },
    {
      "id": "cc_pos_libuv_016",
      "category": "call_chain",
      "identity": [
        "fn:uv__io_poll",
        "fn:uv__queue_head"
      ],
      "kind": "direct_call",
      "expected_exists": true,
      "evidence": [
        {
          "file": "third_party/libuv/src/unix/kqueue.c",
          "line": 193,
          "snippet": "q = uv__queue_head(&loop->watcher_queue);"
        }
      ],
      "notes": "uv__io_poll 读取 watcher queue 头部"
    },
    {
      "id": "cc_neg_libuv_004",
      "category": "call_chain",
      "identity": [
        "fn:uv_run",
        "fn:uv__run_timers"
      ],
      "kind": "callback_edge",
      "expected_exists": false,
      "evidence": [
        {
          "file": "third_party/libuv/src/unix/core.c",
          "line": 442,
          "snippet": "uv__run_timers(loop);"
        }
      ],
      "notes": "uv_run 到 uv__run_timers 是 direct_call；source/target 相同但 kind 错误，仍为 negative"
    },
    {
      "id": "cc_neg_libuv_005",
      "category": "call_chain",
      "identity": [
        "fn:uv_run",
        "fn:uv__io_poll"
      ],
      "kind": "indirect_call",
      "expected_exists": false,
      "evidence": [
        {
          "file": "third_party/libuv/src/unix/core.c",
          "line": 460,
          "snippet": "uv__io_poll(loop, timeout);"
        }
      ],
      "notes": "uv_run 到 uv__io_poll 是直接调用，不是 indirect_call"
    },
    {
      "id": "cc_neg_libuv_006",
      "category": "call_chain",
      "identity": [
        "fn:uv_run",
        "fn:uv__run_prepare"
      ],
      "kind": "callback_edge",
      "expected_exists": false,
      "evidence": [
        {
          "file": "third_party/libuv/src/unix/core.c",